"link","reference_time","article_time","title","text","author","tags"
"https://www.metalbulletin.ru/news/black/10179566/","2024-05-31 01:32:53.362554","2024-05-31 00:00:00","US Steel и Nippon Steel получили все разрешения на слияние за пределами США","Как сообщает агентство Reuters, US Steel Corp и японская Nippon Steel получили все одобрения регулирующих органов за пределами США на предлагаемое слияние стоимостью $14,9 млрд, сообщили компании в четверг.
Nippon заключила сделку о покупке US Steel в декабре прошлого года, вытеснив конкурентов, включая Cleveland-Cliffs, ArcelorMittal и Nucor.
Теперь сталелитейным компаниям необходимо получить одобрение в США, где сделка сталкивается с пристальным вниманием регулирующих органов и растущей политической оппозицией, в том числе со стороны президента Джо Байдена, который хочет, чтобы US Steel оставалась внутренней собственностью.
Предлагаемая сделка также сталкивается с противодействием со стороны влиятельного профсоюза United Steelworkers из-за опасений потери рабочих мест и находится на рассмотрении Министерства юстиции США.
Nippon попыталась решить эту проблему, пообещав соблюдать все соглашения, заключенные между US Steel и профсоюзом. Компания также заявила, что перенесет свою штаб-квартиру в США в Питтсбург, где базируется US Steel.
В четверг компании подтвердили, что ожидают завершения сделки во второй половине этого года.
«US Steel и Nippon Steel обязуются, как и в прошлые месяцы, продолжать в полной мере сотрудничать с соответствующими органами при проверке и полны решимости завершить сделку», — заявили они.
Предлагаемая сделка уже получила одобрение Европейской комиссии и регулирующих органов Мексики, Сербии, Словакии, Турции и Великобритании.
Акции US Steel выросли на 1,7% до $37,77 в начале торгов.
Акционеры US Steel в апреле проголосовали за сделку, которая поможет Nippon — четвертому по величине производителю стали в мире — продвинуться к своей цели — иметь 100 миллионов метрических тонн мировых мощностей по производству сырой стали.","REUTERS",
"https://www.metalbulletin.ru/news/black/10179542/","2024-05-31 01:32:53.384872","2024-05-31 00:00:00","Прибыль Tata Steel за квартал упала из-за снижения цен на фоне реструктуризации","Как сообщает агентство Reuters, индийская компания Tata Steel заявила в среду, что сохранит большинство рабочих мест, реструктурируя свою деятельность в Великобритании после падения прибыли в четвертом квартале из-за снижения цен на сталь и расходов на обесценение.
Второй по величине производитель стали в стране по рыночной капитализации заявил, что его консолидированная чистая прибыль упала на 64% до 6,11 миллиарда рупий ($73,3 млн) за три месяца, закончившихся 31 марта.
«Мы стремимся создать бизнес по производству стали с низким содержанием углекислого газа, который сохранит большинство рабочих мест в Великобритании, а также создаст экономические возможности», - сказал генеральный директор и управляющий директор Т. В. Нарендран.
Компания находится в процессе закрытия двух своих доменных печей в Великобритании, что приведет к потере до 2800 рабочих мест на сталелитейном заводе в Порт-Талботе в Уэльсе. Британское профсоюзное сообщество проголосовало за забастовку против этих планов сокращения рабочих мест.
Между тем, внутренние цены на сталь оставались под давлением в течение квартала, поскольку Индия импортировала большие объемы готовой стали из Китая, крупнейшего производителя.
Общий доход от операционной деятельности упал до 586,87 млрд рупий с 629,62 млрд рупий за квартал из-за почти 4%-ного падения основного бизнеса в Индии, на который приходилось не менее 62% общего дохода.
Компания также понесла исключительные расходы в размере 6,49 млрд рупий в связи с закрытием хромитового блока Сукинда в Одише и другими расходами, связанными с ее европейскими операциями.
Кроме того, компания, управляемая Tata Group, привлечет 30 миллиардов рупий за счет выпуска долговых ценных бумаг, сообщило агентство в среду.
Он также сообщил, что ввод в эксплуатацию завода мощностью 5 миллионов тонн в год (MTPA) в Калинганагаре продолжается.","REUTERS",
